Product URL,Product Name,Product Price,Rating,Number Of Reviews
https://www.amazon.in/AirCase-Anti-Gravity-Ergonomic-Technology-Protected/dp/B0B87K8YHG/ref=sr_1_1_sspa?crid=2M096C61O4MLT&keywords=bags&qid=1663946618&refinements=p_72%3A1318478031&rnid=1318475031&sprefix=ba%2Caps%252&sr=8-1-spons&psc=1&spLa=ZW5jcnlwdGVkUXVhbGlmaWVyPUExRkxJVk42TDRFQkxUJmVuY3J5cHRlZElkPUEwNzQ0MzY5WTY1NzFRM0QwUVFGJmVuY3J5cHRlZEFkSWQ9QTA1MzQzNzgzSTNaSzEzTzE4S0hIJndpZGdldE5hbWU9c3BfYXRmJmFjdGlvbj1jbGlja1JlZGlyZWN0JmRvTm90TG9nQ2xpY2s9dHJ1ZQ==,"      AirCase Anti-Gravity Backpack for Men & Women, Weight Reducing 15.6” Laptop Bag for Travel & Office, Ergonomic Technology for Posture & Muscle Support, Patent Protected, in-Built Shock Absorber, Grey","?3,999.00",5 out of 5,4
https://www.amazon.in/WENGER-604428-Laptop-Backpack-Centimeters/dp/B07DKW5X1W/ref=sr_1_2_sspa?crid=2M096C61O4MLT&keywords=bags&qid=1663946618&refinements=p_72%3A1318478031&rnid=1318475031&sprefix=ba%2Caps%252&sr=8-2-spons&psc=1&spLa=ZW5jcnlwdGVkUXVhbGlmaWVyPUExRkxJVk42TDRFQkxUJmVuY3J5cHRlZElkPUEwNzQ0MzY5WTY1NzFRM0QwUVFGJmVuY3J5cHRlZEFkSWQ9QTA5MDg0NjQxWFlKOTI5NlZDUVA1JndpZGdldE5hbWU9c3BfYXRmJmFjdGlvbj1jbGlja1JlZGlyZWN0JmRvTm90TG9nQ2xpY2s9dHJ1ZQ==,"WENGER 604428 MARS 16 Inch Laptop Backpack Blue 46 Centimeters, M","?2,940.00",4.5 out of 5,2
https://www.amazon.in/dp/B08R7RPVJF/ref=sspa_dk_detail_0?ie=UTF8&psc=1&pd_rd_i=&pd_rd_i=B08R7RPVJFp13NParams&s=computers&sp_csd=d2lkZ2V0TmFtZT1zcF9kZXRhaWw,`Lenovo Slim Everyday Backpack,?599.00,4.4 out of 5,"1,966"
https://www.amazon.in/dp/B0B81YTTWS/ref=sspa_dk_detail_1?ie=UTF8&psc=1&pd_rd_i=&pd_rd_i=B0B81YTTWSp13NParams&s=computers&sp_csd=d2lkZ2V0TmFtZT1zcF9kZXRhaWw,"uppercase Medium 23L Tall Boy Laptop Backpack 2500EBP1 3x more water repellent sustainable bags with rain proof zippers for Men, Women, Boys and Girls, 750 Days warranty","1,550.00",4 out of 5,28
https://www.amazon.in/dp/B084QGF2JM/ref=sspa_dk_detail_2?ie=UTF8&psc=1&pd_rd_i=&pd_rd_i=B084QGF2JMp13NParams&s=computers&sp_csd=d2lkZ2V0TmFtZT1zcF9kZXRhaWw,"Arctic Hunter Laptop Bag,35L Expandable Backpack for Travel Business Backpack Fit Upto 17 inch Laptop Water-resistant Anti-theft Backapck with USB Charging Port Multi-Layer Large Capacity Bag,Black","3,303.00",4.5 out of 5,128
https://www.amazon.in/dp/B085M4TFND/ref=sspa_dk_detail_4?ie=UTF8&psc=1&pd_rd_i=&pd_rd_i=B085M4TFNDp13NParams&s=computers&sp_csd=d2lkZ2V0TmFtZT1zcF9kZXRhaWw,"US AER U.S.AER Backpack Model-X (Space Black)/ Water Repellent/ 15.6"" Laptop Compatibility","? 1,499.00",5 out of 5,4
https://www.amazon.in/dp/B0B68ZS5G1/ref=sspa_dk_detail_5?ie=UTF8&psc=1&pd_rd_i=&pd_rd_i=B0B68ZS5G1p13NParams&s=computers&sp_csd=d2lkZ2V0TmFtZT1zcF9kZXRhaWw,"uppercase Medium 19L Laptop Backpack 1600EBP1 Compact 3x more water repellent sustainable bags with rain proof zippers for Men, Women, Boys and Girls , 750 Days warranty","? 1,000.00",4.5 out of 5,56
https://www.amazon.in/dp/B084QGF2JM/ref=sspa_dk_detail_6?ie=UTF8&psc=1&pd_rd_i=&pd_rd_i=B084QGF2JMp13NParams&s=computers&sp_csd=d2lkZ2V0TmFtZT1zcF9kZXRhaWw,"Arctic Hunter Laptop Bag,35L Expandable Backpack for Travel Business Backpack Fit Upto 17 inch Laptop Water-resistant Anti-theft Backapck with USB Charging Port Multi-Layer Large Capacity Bag,Black","? 3,303.00",4.5 out of 5,128
https://www.amazon.in/dp/B084LBMKMT/ref=sspa_dk_detail_7?ie=UTF8&psc=1&pd_rd_i=&pd_rd_i=B084LBMKMTp13NParams&s=computers&sp_csd=d2lkZ2V0TmFtZT1zcF9kZXRhaWw,"Arctic Hunter Slim Laptop Backpack Fit 15.6 Inch Business Travel Bag with Luggage Strap, Water Resistant Backpack for Men & Woman","? 2,499.00",4.2 out of 5,61
https://www.amazon.in/dp/B00QMFAWBO/ref=sspa_dk_detail_8?ie=UTF8&psc=1&pd_rd_i=&pd_rd_i=B00QMFAWBOp13NParams&s=computers&sp_csd=d2lkZ2V0TmFtZT1zcF9kZXRhaWw,Wenger 18 Ltrs Black Laptop Backpack (72992290),"? 5,208.00",4.6 out of  5,2
https://www.amazon.in/dp/B0B69M182Q/ref=sspa_dk_detail_9?ie=UTF8&psc=1&pd_rd_i=&pd_rd_i=B0B69M182Qp13NParams&s=computers&sp_csd=d2lkZ2V0TmFtZT1zcF9kZXRhaWw,"uppercase Medium 17L Vegan Leather Laptop Backpack 2300EBP1 3x more water repellent sustainable bags with rain proof zippers for Men, Women, Boys and Girls, 750 Days warranty (Green)","? 1,400.00",4.2 out of 5,23
https://www.amazon.in/dp/B07DKJFNX3/ref=sspa_dk_detail_0?ie=UTF8&psc=1&s=computers&sp_csd=d2lkZ2V0TmFtZT1zcF9kZXRhaWw,"WENGER MERCURY ESSENTIAL Laptop Backpack Black - 604433, M","? 3,500.00",4.5 out of 5,16
https://www.amazon.in/dp/B0B68Z3X7D/ref=sspa_dk_detail_1?ie=UTF8&psc=1&s=computers&sp_csd=d2lkZ2V0TmFtZT1zcF9kZXRhaWw,"uppercase Medium 17L Vegan Leather Laptop Backpack 2300EBP1 3x more water repellent sustainable bags with rain proof zippers for Men, Women, Boys and Girls, 750 Days warranty (Blue)","? 1,400.00",4.3 out of 5,47
https://www.amazon.in/dp/B07QHK5DWF/ref=sspa_dk_detail_2?ie=UTF8&psc=1&s=computers&sp_csd=d2lkZ2V0TmFtZT1zcF9kZXRhaWw,"Wenger WEEKEND LIFESTYLE TECHPACK 14 Inch Laptop Backpack with Tablet Pocket, customizable padded dividers, built in rain cover (12 Litre)-blend of style & function, Swiss designed, 606488","? 9,020.00",3.6 out of 5,10
https://www.amazon.in/dp/B07TW713SC/ref=sspa_dk_detail_3?ie=UTF8&psc=1&s=computers&sp_csd=d2lkZ2V0TmFtZT1zcF9kZXRhaWw,"AH Arctic Hunter 28L Laptop Backpack for Men,15.6inch Slim Water Resistant & Anti-Theft College Backpack with USB Charging,Business,Office,Travel Bag (Black)","? 2,231.00",4.1 out of 5,241
https://www.amazon.in/dp/B07XJQ9GQY/ref=sspa_dk_detail_4?ie=UTF8&s=computers&sp_csd=d2lkZ2V0TmFtZT1zcF9kZXRhaWw&th=1,"Dyazo Design 3 Type Anti Theft Backpack/Breifcase/Office Bag Anti Theft Laptop Backpack for 15.6 Inch Laptop, 22 L Bagpack/Suitable for Office,Travelling, Designed for Unisex (Jet Black), D 554","? 2,199.00",3.9 out of 5,547
https://www.amazon.in/dp/B085M5MNX2/ref=sspa_dk_detail_5?ie=UTF8&psc=1&s=computers&sp_csd=d2lkZ2V0TmFtZT1zcF9kZXRhaWw,US AER ® Unisex Model-X Water Repellent 15.6-inch Laptop Compatibility Backpack (Blue),"? 1,499.00",4.5 out of 5,3
https://www.amazon.in/dp/B073XDS39K/ref=sspa_dk_detail_6?ie=UTF8&psc=1&s=computers&sp_csd=d2lkZ2V0TmFtZT1zcF9kZXRhaWw,"Victorinox Altmont Active, Everyday Laptop Backpack, 13 Litres Grey (602133)","? 4,308.00",4.5 out of 5,29
https://www.amazon.in/dp/B0B81WST7X/ref=sspa_dk_detail_7?ie=UTF8&psc=1&s=computers&sp_csd=d2lkZ2V0TmFtZT1zcF9kZXRhaWw,"uppercase Medium 23L Tall Boy Laptop Backpack 2500EBP1 3x more water repellent sustainable bags with rain proof zippers for Men, Women, Boys and Girls, 750 Days warranty","? 1,550.00",4 out of 5,28
https://www.amazon.in/dp/B09HCPV1R9/ref=sspa_dk_detail_8?ie=UTF8&psc=1&s=computers&sp_csd=d2lkZ2V0TmFtZT1zcF9kZXRhaWw,"Artistix Axile three dimensional backpack, 30 Ltrs 46 cms, Foldable Travel cum Office Laptop Backpack, Anti theft bag","? 1,352.00",4.4 out of 54.4 out of 5,111
https://www.amazon.in/dp/B085M8H3RS/ref=sspa_dk_detail_9?ie=UTF8&psc=1&s=computers&sp_csd=d2lkZ2V0TmFtZT1zcF9kZXRhaWw,US AER ® Unisex Model-X Water Repellent 15.6-inch Laptop Compatibility Backpack (Blue),"? 1,499.00",5 out of 5,1
https://www.amazon.in/dp/B09H7J8L5X/ref=sspa_dk_detail_10?ie=UTF8&psc=1&s=computers&sp_csd=d2lkZ2V0TmFtZT1zcF9kZXRhaWw,"Scarters Groove - 20L Laptop Backpack,Bag for Office/College/Business/Travel for Laptop & MacBook Upto 15.6 inches","? 2,902.50",4.7 out of 5,31
https://www.amazon.in/dp/B00HD9CAAY/ref=sspa_dk_detail_0?ie=UTF8&psc=1&s=computers&sp_csd=d2lkZ2V0TmFtZT1zcF9kZXRhaWw,"WENGER NANOBYTE 13 Inch Laptop Backpack, Padded Laptop Compartment with iPad/Tablet/eReader Pocket in Black-blend of style & function, Swiss designed, 600626, S","? 5,128.00",4.1 out of 5,84
https://www.amazon.in/dp/B0B6FNPN76/ref=sspa_dk_detail_1?ie=UTF8&psc=1&s=computers&sp_csd=d2lkZ2V0TmFtZT1zcF9kZXRhaWw,"Arctic Hunter Laptop Bag,Business Backpack,30L Travel Backpack Laptop Backpack with 15.6-inch Laptop Compartment Water/Scratch-resistant Multiple Pocket Comfortable and Thick Backpack for Men Large Capacity,Black","? 5,356.00",3.6 out of 5,4
https://www.amazon.in/dp/B097JK3X9D/ref=sspa_dk_detail_2?ie=UTF8&psc=1&s=computers&sp_csd=d2lkZ2V0TmFtZT1zcF9kZXRhaWw,"Safari Crew Overnighter Backpack, 40 Ltr Water Resistant Travel Laptop Bag, Black Polyester Backpack for Men and Women, Spacious Shoulder Bag for Travelling and Camping","? 1,999.00",3.2 out of 5,8
https://www.amazon.in/dp/B084Q21RW6/ref=sspa_dk_detail_4?ie=UTF8&psc=1&s=computers&sp_csd=d2lkZ2V0TmFtZT1zcF9kZXRhaWw,"AH Arctic Hunter 3 in 1 Expandable from 19L to 32L, Water & Scratch Resistant Backpack fits up to 15.6 inches Laptop, with USB Port,Earphone Port for Business,Travelling for Men & Women. (Black)","? 3,213.00",4.3 out of 5,92
https://www.amazon.in/dp/B07MH3S3Q1/ref=sspa_dk_detail_3?ie=UTF8&psc=1&s=computers&sp_csd=d2lkZ2V0TmFtZT1zcF9kZXRhaWw,"Victorinox Vx Touring Sage Camo 24 L 17'' Laptop Backpack - 605625, Standard","? 12,222.00",4.4 out of 5,10
https://www.amazon.in/dp/B08H8D5F4P/ref=sspa_dk_detail_5?ie=UTF8&psc=1&s=computers&sp_csd=d2lkZ2V0TmFtZT1zcF9kZXRhaWw,YESO Water Resistant Polyester 29 litres Unisex Business Travel Laptop Backpack fits 15.6 inch laptops (Suburb),"? 1,889.00",4.1 out of 5,264
https://www.amazon.in/dp/B07DKW5X1W/ref=sspa_dk_detail_6?ie=UTF8&psc=1&s=computers&sp_csd=d2lkZ2V0TmFtZT1zcF9kZXRhaWw,"WENGER 604428 MARS 16 Inch Laptop Backpack Blue 46 Centimeters, M","? 2,940.00",4.5 out of 5,2
https://www.amazon.in/dp/B07M9FJLMK/ref=sspa_dk_detail_0?ie=UTF8&psc=1&s=computers&sp_csd=d2lkZ2V0TmFtZT1zcF9kZXRhaWw,Harissons Sirius 45 Ltrs Executive Laptop Backpack (Up to 15.6 Inch) with USB Charging Connector & Built-in Waterproof Raincover,"? 3,084.00",4.4 out of 5,1845
https://www.amazon.in/dp/B08T96KXTF/ref=sspa_dk_detail_1?ie=UTF8&psc=1&s=computers&sp_csd=d2lkZ2V0TmFtZT1zcF9kZXRhaWw,"Golden Wolf Laptop Bag,Business Anti Theft Backpack with Lock,Water Resistant College School Laptop Backpack with Rain Cover and USB Charging Port Earphone Port,Backpack Gifts for 15.6 inch Laptop 25 L Travel Bag For Women & Men,Light Grey","? 1,912.00",4.4 out of 5,2826
https://www.amazon.in/dp/B07BZ5VC4H/ref=sspa_dk_detail_6?ie=UTF8&psc=1&s=computers&sp_csd=d2lkZ2V0TmFtZT1zcF9kZXRhaWw,Safari Seek 45 Ltrs Overnighter Expandable Travel Laptop Backpack,"? 1,599.00",4.5 out of 54.5 out of 5,4770
https://www.amazon.in/dp/B097XY6DXJ/ref=sspa_dk_detail_5?ie=UTF8&psc=1&s=computers&sp_csd=d2lkZ2V0TmFtZT1zcF9kZXRhaWw,"Artistix Axile three dimensional backpack, 30 Ltrs 46 cms, Foldable Travel cum Office Laptop Backpack, Anti theft bag","? 1,352.00",4.4 out of 5,111
https://www.amazon.in/dp/B09W4X977X/ref=sspa_dk_detail_4?ie=UTF8&psc=1&s=computers&sp_csd=d2lkZ2V0TmFtZT1zcF9kZXRhaWw,Amazon Basics - Casual 21L  Laptop Backpack,? 649.00,4.5 out of 5,6
https://www.amazon.in/dp/B084TN7VGZ/ref=sspa_dk_detail_3?ie=UTF8&psc=1&s=computers&sp_csd=d2lkZ2V0TmFtZT1zcF9kZXRhaWw,"Tizum Z28- 13 Inch/14 Inch/15.6 Inch Laptop Backpack with USB Charging Port, Water Repellent, Multiutility compartments, Anti-Theft Backpack for Men and Women (Green)","? 1,599.00",4.2 out of 5,19
https://www.amazon.in/dp/B08532K9T2/ref=sspa_dk_detail_2?ie=UTF8&s=computers&sp_csd=d2lkZ2V0TmFtZT1zcF9kZXRhaWw&th=1,YESO USB Charging Unisex Large Capacity Multifunction Water Resistant Travel Business Laptop Backpack for 15.6 inch Laptop (Town),"? 2,729.00",4.1 out of 5,264
https://www.amazon.in/dp/B09T5XXS9T/ref=sspa_dk_detail_0?ie=UTF8&psc=1&s=computers&sp_csd=d2lkZ2V0TmFtZT1zcF9kZXRhaWw,"Wenger MARS Laptop Backpack with Padded compartment for 16 Inch laptop & 10 Inch tablet, Organizer for essentials in Black/Grey (26 Litre)-blend of style & function, Swiss designed, 612034","?2,520.00
",5 out of 5,1
https://www.amazon.in/dp/B08MCGYVQ6/ref=sspa_dk_detail_1?ie=UTF8&psc=1&s=computers&sp_csd=d2lkZ2V0TmFtZT1zcF9kZXRhaWw,"Wenger CRANGO 16 Inch Laptop Backpack with Organizer for essentials, Dedicated patch for a bicycle light in Rust Alps Print (27 Litre)-blend of style & function, Swiss designed, 612030","? 1,691.00",4.2 out of 5,10
https://www.amazon.in/dp/B09R23HB9N/ref=sspa_dk_detail_2?ie=UTF8&psc=1&s=computers&sp_csd=d2lkZ2V0TmFtZT1zcF9kZXRhaWw,KINGSONS Water Resistant Polyester Unisex 15.6 inch Laptop Backpack Travel Backpack with USB Charging Port & Anti-theft Back Pocket (Black),"? 3,479.00",,
https://www.amazon.in/dp/B085GDV195/ref=sspa_dk_detail_3?ie=UTF8&psc=1&smid=APBFC7AMQ4Q38&s=computers&sp_csd=d2lkZ2V0TmFtZT1zcF9kZXRhaWw,"EUME Propine Premium 22 Ltrs Massager Backpack for Men & Women with Built-in Massager Technology for your Back relief | Lightweight & Water Resistant | Best for Business, College, Travelers & Office Use | Fits Up-to 15.6"" MacBook or Laptop | Camo Black Color"," ?3,239.00
",4.1 out of 5,43
https://www.amazon.in/dp/B071NL48V3/ref=sspa_dk_detail_4?ie=UTF8&psc=1&s=computers&sp_csd=d2lkZ2V0TmFtZT1zcF9kZXRhaWw,Victorinox,5247,4.4 out of 5,39
https://www.amazon.in/dp/B09V7R98XC/ref=sspa_dk_detail_5?ie=UTF8&psc=1&smid=A2ZJIE4OXD710M&s=computers&sp_csd=d2lkZ2V0TmFtZT1zcF9kZXRhaWw,Mokobara The Transit Backpack Laptop Bag for Men and Women,"? 4,990.00",4.2 out of 5,176
https://www.amazon.in/dp/B08FQWH9BV/ref=sspa_dk_detail_6?ie=UTF8&s=computers&sp_csd=d2lkZ2V0TmFtZT1zcF9kZXRhaWw&th=1,YESO Water Resistant Polyester 20 litres Unisex Business Travel Laptop Backpack fits 15.6 inch laptops (Mayor-Black),"? 2,539.00",4.1 out of 5,264
https://www.amazon.in/dp/B07NQZSRFH/ref=sspa_dk_detail_0?ie=UTF8&psc=1&smid=A3KN9TP27V04QR&s=computers&sp_csd=d2lkZ2V0TmFtZT1zcF9kZXRhaWw,CAT Tarppowerng 15 Ltrs Black Laptop Backpack (83679-01),"? 2,399.00",3.7 out of 5,7
https://www.amazon.in/dp/B09R24PNGL/ref=sspa_dk_detail_1?ie=UTF8&psc=1&s=computers&sp_csd=d2lkZ2V0TmFtZT1zcF9kZXRhaWw,KINGSONS Flat Open Water Resistant Polyester Unisex 15.6 inch Laptop Backpack Travel Backpack with USB Charging Port (Grey),"? 3,479.00",,
https://www.amazon.in/dp/B08B3GL2QF/ref=sspa_dk_detail_2?ie=UTF8&psc=1&s=computers&sp_csd=d2lkZ2V0TmFtZT1zcF9kZXRhaWw,The Clownfish Fredrick 27 liters Faux Leather Mature Laptop Backpack for Men and Women for 15.6 Inch Laptops (Hickory),"? 1,059.00",4.1 out of 54.1 out of 5,222
https://www.amazon.in/dp/B01FU4B9JG/ref=sspa_dk_detail_3?ie=UTF8&s=computers&sp_csd=d2lkZ2V0TmFtZT1zcF9kZXRhaWw&th=1,Cosmus Darwin 29 litres Office Backpack - Sleek Everyday use Backpack - Black,"? 1,261.00",4.3 out of 5,9595
https://www.amazon.in/dp/B09PRF5LH3/ref=sspa_dk_detail_4?ie=UTF8&psc=1&s=computers&sp_csd=d2lkZ2V0TmFtZT1zcF9kZXRhaWw,Okami Wolf GoPack 'Switch' Hybrid Laptop Backpack with USB Fast Charging,"? 3,199.00",4.2 out of 5,46
https://www.amazon.in/dp/B0892LFHHB/ref=sspa_dk_detail_5?ie=UTF8&psc=1&s=computers&sp_csd=d2lkZ2V0TmFtZT1zcF9kZXRhaWw,"Okami Wolf GoPack Anti-Theft Laptop Backpack with USB Fast Charging, Black","? 3,149.00",4.5 out of 5,616
https://www.amazon.in/dp/B0851B88J4/ref=sspa_dk_detail_6?ie=UTF8&psc=1&s=computers&sp_csd=d2lkZ2V0TmFtZT1zcF9kZXRhaWw,Aoking 28 L Casual Water Resistant Laptop Bag Backpack for Men Women Boys Girls Office School College Teens & Students,"? 2,729.00",3.3 out of 5,17
https://www.amazon.in/dp/B085DSP35Z/ref=sspa_dk_detail_0?ie=UTF8&psc=1&s=computers&sp_csd=d2lkZ2V0TmFtZT1zcF9kZXRhaWw,The Clownfish Unisex BANGE 21 L Polyester 2 in 1 Outdoor Travel Laptop Backpack fits 15.6 inch Laptops (Black),"? 5,079.00",3.7 out of 5,33
https://www.amazon.in/dp/B0B1Q2C97R/ref=sspa_dk_detail_1?ie=UTF8&psc=1&smid=ATI0D1HO155ZO&s=computers&sp_csd=d2lkZ2V0TmFtZT1zcF9kZXRhaWw,Sketchfab Casual Waterproof Laptop Bag /College/School/Office 35 L Travel Backpack Unisex Women Men Boys Girls Children Daypack Book Sports Weekend Lightweight Bags for Stylish & Office,? 599.00,3.3 out of 5,17
https://www.amazon.in/dp/B084L1D8V3/ref=sspa_dk_detail_2?ie=UTF8&psc=1&s=computers&sp_csd=d2lkZ2V0TmFtZT1zcF9kZXRhaWw,MOCA Laptop Regular use Backpack Bag for Mens Womens EXPANDABLE Travel Daypack Outdoor Work Office College School Laptop Backpack Bag for 15.6 inch Mens Men Laptop Backpack Bag,"? 2,499.00",5 out of 5,1
https://www.amazon.in/dp/B086V9G1TP/ref=sspa_dk_detail_3?ie=UTF8&s=computers&sp_csd=d2lkZ2V0TmFtZT1zcF9kZXRhaWw&th=1,"Fur Jaden 15.6 Inch Laptop Backpack 38 LTR Large Bagpack for Men for Office, School Bag for Students (Black)",? 649.00,3.9 out of 5,436
https://www.amazon.in/dp/B08L9P8SVZ/ref=sspa_dk_detail_4?ie=UTF8&psc=1&s=computers&sp_csd=d2lkZ2V0TmFtZT1zcF9kZXRhaWw,BRAND LEATHER Full Grain Buffalo - Hide Leather Backpack Large Capacity 17 Inch Laptop Bag Multi Pockets Travel Daypack,"? 5,567.00",4.2 out of 5,66
https://www.amazon.in/dp/B07MD1G8RZ/ref=sspa_dk_detail_5?ie=UTF8&psc=1&s=computers&sp_csd=d2lkZ2V0TmFtZT1zcF9kZXRhaWw,Harissons Sirius 45 Ltrs Executive Laptop Backpack (Up to 15.6 Inch) with USB Charging Connector & Built-in Waterproof Raincover,"? 3,084.00",4.4 out of 5,1845
https://www.amazon.in/dp/B07H3XGZSD/ref=sspa_dk_detail_6?ie=UTF8&psc=1&smid=APBFC7AMQ4Q38&s=computers&sp_csd=d2lkZ2V0TmFtZT1zcF9kZXRhaWw,"EUME GenX Laptop Backpack | Built-in Massager, Water Resistant & Anti-Theft | Fits Up-to 15.6"" Laptop (Peacock)","? 4,410.00",3.9 out of 5,81
https://www.amazon.in/dp/B0B9T7PD7T/ref=sspa_dk_detail_0?ie=UTF8&psc=1&s=computers&sp_csd=d2lkZ2V0TmFtZT1zcF9kZXRhaWw,uppercase Medium 19L Laptop Backpack 1800EBP1 Printed Compact 3x more water repellent sustainable bags with rain proof zippers (Blue),"? 1,100.00",4 out of 5,5
https://www.amazon.in/dp/B09D3YJ9WX/ref=sspa_dk_detail_1?ie=UTF8&psc=1&s=computers&sp_csd=d2lkZ2V0TmFtZT1zcF9kZXRhaWw,Harissons Bags Volt 15.6 inch Office Laptop Backpacks for Men and Women,"? 1,358.00",4.3 out of 5,136
https://www.amazon.in/dp/B085C8DDB7/ref=sspa_dk_detail_2?ie=UTF8&psc=1&s=computers&sp_csd=d2lkZ2V0TmFtZT1zcF9kZXRhaWw,The Clownfish 16 litres Unisex Polyester Outdoor Travel Laptop Backpack fits 15.6 inch Laptop (Black),"? 2,119.00",3.9 out of 5,114
https://www.amazon.in/dp/B09QL66G55/ref=sspa_dk_detail_3?ie=UTF8&psc=1&s=computers&sp_csd=d2lkZ2V0TmFtZT1zcF9kZXRhaWw,WILDHORN 31L Water Resistant Office Laptop Bag / Backpack for Men / Women I Travel / Business / College Bookbags Fit 15.6 Inch Laptop,? 509.00,4.1 out of 5,53
https://www.amazon.in/dp/B09WZKHSDR/ref=sspa_dk_detail_4?ie=UTF8&s=computers&sp_csd=d2lkZ2V0TmFtZT1zcF9kZXRhaWw&th=1,"Bennett Casual Laptop Bag school bags for boys girls 15.6-inch, 25 LTR Office & College bags for mens Water Repellent Backpack for Men & Women (GREY)",? 499.00,3.7 out of 5,92
https://www.amazon.in/dp/B0B68Y7H6F/ref=sspa_dk_detail_5?ie=UTF8&psc=1&s=computers&sp_csd=d2lkZ2V0TmFtZT1zcF9kZXRhaWw,"uppercase Medium 14L Laptop Backpack 2100EBP1 Roll Top Office - College 3x more water repellent sustainable bags with rain proof zippers for Men, Women, Boys and Girls, 750 Days warranty","? 1,100.00",4.7 out of 5,45
https://www.amazon.in/dp/B0B5N9TY9C/ref=sspa_dk_detail_6?ie=UTF8&psc=1&s=computers&sp_csd=d2lkZ2V0TmFtZT1zcF9kZXRhaWw,"uppercase Medium 19L Laptop Backpack 1600EBP1 Compact 3x more water repellent sustainable bags with rain proof zippers for Men, Women, Boys and Girls , 750 Days warranty","? 1,000.00",4.5 out of 5,56
https://www.amazon.in/dp/B07D5VPW75/ref=sspa_dk_detail_7?ie=UTF8&psc=1&smid=APBFC7AMQ4Q38&s=computers&sp_csd=d2lkZ2V0TmFtZT1zcF9kZXRhaWw,"EUME GenX Laptop Backpack | Built-in Massager, Water Resistant & Anti-Theft | Fits Up-to 15.6"" Laptop (Green)","? 4,410.00",3.9 out of 5,81
https://www.amazon.in/dp/B084LFS4G1/ref=sspa_dk_detail_8?ie=UTF8&psc=1&s=computers&sp_csd=d2lkZ2V0TmFtZT1zcF9kZXRhaWw,FATMUG Laptop Bag For Men - Convertible Backpack For Office And Travel (Navy Blue Oxford Fabric),"? 1,499.00",4.4 out of 5,1264
https://www.amazon.in/dp/B07V4RTGPL/ref=sspa_dk_detail_9?ie=UTF8&psc=1&s=computers&sp_csd=d2lkZ2V0TmFtZT1zcF9kZXRhaWw,Husker Nylon GUFF Business Travel Backpack Laptop Bag with USB Port (Black),"? 2,499.00",4.7 out of 5,7
https://www.amazon.in/dp/B09RB1BBS4/ref=sspa_dk_detail_10?ie=UTF8&psc=1&s=computers&sp_csd=d2lkZ2V0TmFtZT1zcF9kZXRhaWw,The Clownfish Water Resistant Polyester Unisex 15.6 inch Travel Laptop Backpack with USB Port,"? 4,199.00",4.7 out of 5,7
https://www.amazon.in/dp/B086816K8Z/ref=sspa_dk_detail_11?ie=UTF8&psc=1&s=computers&sp_csd=d2lkZ2V0TmFtZT1zcF9kZXRhaWw,The Clownfish Tuguan Water Resistant Trendy Laptop Smart Backpack/Messenger Bag/Back Pack Bag,"? 2,819.00",3.7 out of 5,11
https://www.amazon.in/dp/B085C79LNC/ref=sspa_dk_detail_12?ie=UTF8&psc=1&s=computers&sp_csd=d2lkZ2V0TmFtZT1zcF9kZXRhaWw,The Clownfish 16 Litres Unisex Polyester Outdoor Travel Laptop Backpack fits 15.6 inch laptop,"? 2,119.00",3.9 out of 5,114
https://www.amazon.in/dp/B0978JT5HR/ref=sspa_dk_detail_13?ie=UTF8&psc=1&s=computers&sp_csd=d2lkZ2V0TmFtZT1zcF9kZXRhaWw,"WALKENT Waterproof Anti-Theft 15.6 inch Laptop Bag 27L - Expandable, External USB for Office, College, Men Women","? 2,690.00",4.2 out of 5,317
https://www.amazon.in/dp/B07G5G4WNY/ref=sspa_dk_detail_0?ie=UTF8&psc=1&smid=APBFC7AMQ4Q38&s=computers&sp_csd=d2lkZ2V0TmFtZT1zcF9kZXRhaWw,"EUME GenX Laptop Backpack | Built-in Massager, Water Resistant & Anti-Theft | Fits Up-to 15.6"" Laptop (Orange, 26L)","? 4,410.00",3.9 out of 5,81
https://www.amazon.in/dp/B086J7XT88/ref=sspa_dk_detail_1?ie=UTF8&psc=1&s=computers&sp_csd=d2lkZ2V0TmFtZT1zcF9kZXRhaWw,THE CLOWNFISH Arctic Hunter 3 in 1 Expandable 19 L to 32 L Multi-Layer High Capacity 15.6 inch USB Charging Laptop Backpack Travel Business Backpacks (Black- Rhombus),"? 4,039.00",4.1 out of 5,16
https://www.amazon.in/dp/B09PRGP661/ref=sspa_dk_detail_2?ie=UTF8&psc=1&s=computers&sp_csd=d2lkZ2V0TmFtZT1zcF9kZXRhaWw,Okami Wolf GoPack 'City' Laptop Backpack with USB Fast Charging,"? 2,899.00",4 out of 5,44
https://www.amazon.in/dp/B0B6G58BYC/ref=sspa_dk_detail_3?ie=UTF8&psc=1&s=computers&sp_csd=d2lkZ2V0TmFtZT1zcF9kZXRhaWw,"Arctic Hunter Laptop Bag,Messenger bags for Men Laptop Sling Bag with Handle Brifcase for 15.6"" Laptop Multiple Pockets Water-resistant for Travel Office","? 2,678.00",,
https://www.amazon.in/dp/B0B9T4YDPX/ref=sspa_dk_detail_4?ie=UTF8&psc=1&s=computers&sp_csd=d2lkZ2V0TmFtZT1zcF9kZXRhaWw,uppercase Medium 19L Laptop Backpack 1800EBP1 Printed Compact 3x more water repellent sustainable bags with rain proof zippers (Pink),"? 1,100.00",5 out of 5,6
https://www.amazon.in/dp/B0B5NBLGBQ/ref=sspa_dk_detail_5?ie=UTF8&psc=1&s=computers&sp_csd=d2lkZ2V0TmFtZT1zcF9kZXRhaWw,"uppercase Medium 14L Laptop Backpack 2100EBP1 Roll Top Office - College 3x more water repellent sustainable bags with rain proof zippers for Men, Women, Boys and Girls, 750 Days warranty","? 1,150.00",4.7 out of 5,45
https://www.amazon.in/dp/B09DBVZ77H/ref=sspa_dk_detail_6?ie=UTF8&psc=1&s=computers&sp_csd=d2lkZ2V0TmFtZT1zcF9kZXRhaWw,"Dynotrek 13 14 Upto 15.6""Inch Laptop Casual Sack-pack Rucksack Travel Backpack With USB Charging Port For Men & Women Waterproof Backpack Suitable for Chromebook DT02SCB",? 644.00,3.8 out of 5,1077
https://www.amazon.in/dp/B07V6YJ1KG/ref=sspa_dk_detail_0?ie=UTF8&psc=1&s=computers&sp_csd=d2lkZ2V0TmFtZT1zcF9kZXRhaWw,Husker Trail-Walker Luggage Travel Backpack with Laptop Compartment - Grey,"? 2,999.00",4.5 out of 5,56
https://www.amazon.in/dp/B09YP16BZK/ref=sspa_dk_detail_1?ie=UTF8&psc=1&s=computers&sp_csd=d2lkZ2V0TmFtZT1zcF9kZXRhaWw,WILDHORN 26L Water Resistant Office Laptop Bag / Backpack for Men / Women I Travel / Business / College Bookbags Fit 15.6 Inch Laptop,? 999.00,,
https://www.amazon.in/dp/B0BC48FDFR/ref=sspa_dk_detail_2?ie=UTF8&psc=1&s=computers&sp_csd=d2lkZ2V0TmFtZT1zcF9kZXRhaWw,"CraftShades Men & Women's Genuine Leather Backpack Handmade Multipurpose | for Laptop Backpack, Sports, Overnight Travel, Weekend, Collage ( Brown, Size 18 Inches )","? 7,999.00",,
https://www.amazon.in/dp/B0B7FH936K/ref=sspa_dk_detail_3?ie=UTF8&psc=1&s=computers&sp_csd=d2lkZ2V0TmFtZT1zcF9kZXRhaWw,Stark Lightweight Laptop Bags Backpacks for Boys Girls Stylish Men and Women Casual 15.6 inch 32 L Travel Laptop Bag College Office School,"? 1,310.00",4.7 out of 5,8
https://www.amazon.in/dp/B0B4SVHFZJ/ref=sspa_dk_detail_4?ie=UTF8&psc=1&s=computers&sp_csd=d2lkZ2V0TmFtZT1zcF9kZXRhaWw,"Exclusive Power Casual 40 L Water Resistant College/ School/ Office/ Casual/ Travel Backpack with 15.6"" laptop compartment, suitable for both men & women (Black)","? 1,179.00",5 out of 5,2
https://www.amazon.in/dp/B07NZBG7YX/ref=sspa_dk_detail_5?ie=UTF8&psc=1&smid=APBFC7AMQ4Q38&s=computers&sp_csd=d2lkZ2V0TmFtZT1zcF9kZXRhaWw,"EUME Ease Premium 30L Massager Backpack for Men & Women with Built-in Massager Technology for your Back relief | Water Resistant + Free Rain Cover | Best for Business, College, Travel & Office Use | Fits Up-to 15"" MacBook or Laptop | Black Color","? 5,146.00",3.7 out of 5,14
https://www.amazon.in/dp/B09QT2L9H2/ref=sspa_dk_detail_6?ie=UTF8&psc=1&s=computers&sp_csd=d2lkZ2V0TmFtZT1zcF9kZXRhaWw,"Luzian Orion 15.6-inch Laptop/Travel/Casual Backpack for Men and Women with rain Cover (Black, 42 Ltrs)","? 1,099.00",4.6 out of 5,8
https://www.amazon.in/dp/B08VS5NYYV/ref=sspa_dk_detail_0?ie=UTF8&psc=1&s=computers&sp_csd=d2lkZ2V0TmFtZT1zcF9kZXRhaWw,CoolBELL Unisex Water Resistant Nylon 15.6 inch Laptop Backpack with USB Charging Port,"? 2,099.00",4 out of 5,1
https://www.amazon.in/dp/B0BC8KX3F4/ref=sspa_dk_detail_1?ie=UTF8&psc=1&s=computers&sp_csd=d2lkZ2V0TmFtZT1zcF9kZXRhaWw,"CraftShades Men & Women's Genuine Leather Backpack Handmade Multipurpose | for Laptop Backpack, Sports, Overnight Travel, Weekend, Collage ( Brown, Size 16 Inches )","? 7,999.00",,
https://www.amazon.in/dp/B0B2F43DFC/ref=sspa_dk_detail_2?ie=UTF8&psc=1&s=computers&sp_csd=d2lkZ2V0TmFtZT1zcF9kZXRhaWw,"ACTATIVE NEVER STOPS Unisex Medium Size Bag Stylish Laptop Backpack, Casual Daypacks Business Travel Rucksack Bag Water Resistant Ideal For Rainy Season For Men And Women, School College Students Bags For Boys And Girls With 2 Large Compartments - 39X25X49 CM",? 999.00,5 out of 5,1
